{
  "schemaVersion": 1,
  "generatedAt": "2026-06-27T23:25:01.690Z",
  "registry": "receptron/mulmoclaude-collections",
  "collections": [
    {
      "id": "isamu/lens",
      "author": "isamu",
      "slug": "lens",
      "title": "カメラのレンズ",
      "icon": "camera",
      "description": "所有・気になっているカメラレンズを記録するコレクション。焦点距離・F値・マウント・対応フォーマットなどのスペックを管理し、焦点距離バー・35mm換算トグル・マウント/フォーマット絞り込みを備えた『図鑑』カスタムビューで手持ちのレンズ資産を一覧できる。",
      "version": "1.0.0",
      "tags": [
        "photography",
        "camera",
        "gear",
        "personal"
      ],
      "license": "MIT",
      "fieldCount": 33,
      "views": [
        "図鑑"
      ],
      "hasSeed": true,
      "seedCount": 6,
      "path": "collections/isamu/lens",
      "contentSha": "ffc1739615aa4a68"
    },
    {
      "id": "isamu/movies",
      "author": "isamu",
      "slug": "movies",
      "title": "映画リスト",
      "icon": "movie",
      "description": "観たい・観た映画を記録するコレクション。ジャンル/テーマ/監督/視聴方法/評価/鑑賞日を管理し、Netflix 風の『シネマ』カスタムビューでサムネ表示できる。",
      "version": "1.0.0",
      "tags": [
        "entertainment",
        "personal",
        "movies"
      ],
      "license": "MIT",
      "fieldCount": 15,
      "views": [
        "シネマ"
      ],
      "hasSeed": true,
      "seedCount": 3,
      "path": "collections/isamu/movies",
      "contentSha": "305247fb2e1432da"
    }
  ]
}
